"Name","Address","Website","Type","Awards offered","Campus setting","Campus housing","Student population","Undergraduate students","Graduation Rate","Transfer-Out Rate","Cohort Year *","Net Price **","Largest Program","IPEDS ID","OPE ID"
"Heritage Christian University","3625 Helton Dr, Florence, Alabama 35630-9977","www.hcu.edu","4-year, Private not-for-profit","Associate's degree|Bachelor's degree|Master's degree","City: Small","Yes","78","51","50%","NA","Fall 2012","$7,799","-","101453","02199700"
"Herzing University-Birmingham","280 West Valley Ave, Birmingham, Alabama 35209","https://www.herzing.edu/","4-year, primarily associate's, Private not-for-profit","Less than one year certificate|One but less than two years certificate|Associate's degree|Bachelor's degree|Master's degree|Post-master's certificate","Suburb: Large","No","571","551","50%","NA","Fall 2012","$17,906","-","101365","00962107"
"High Tech High Graduate School of Education","2861 Womble Road, San Diego, California 92106","hthgse.edu","4-year, Private not-for-profit","Master's degree","City: Large","No","34","","NA","NA","Fall 2012","NA","-","485403","04217400"
"Holy Apostles College and Seminary","33 Prospect Hill Road, Cromwell, Connecticut 06416-2005","www.holyapostles.edu","4-year, Private not-for-profit","Associate's degree|Bachelor's degree|Postbaccalaureate certificate|Master's degree|Post-master's certificate","Suburb: Large","No","546","166","60%","20%","Fall 2012","$17,415","-","129534","00138900"
"Holy Names University","3500 Mountain Blvd, Oakland, California 94619-1699","www.hnu.edu","4-year, Private not-for-profit","Bachelor's degree|Postbaccalaureate certificate|Master's degree|Post-master's certificate","City: Large","Yes","960","632","48%","5%","Fall 2012","$23,416","-","115728","00118300"
"Homestead Schools","23800 Hawthorne Blvd. Ste 200, Torrance, California 90505","www.homesteadschools.net","4-year, primarily associate's, Private not-for-profit","Less than one year certificate|One but less than two years certificate|Bachelor's degree","City: Midsize","No","197","197","100%","NA","Fall 2012","$12,285","Licensed Practical/Vocational Nurse Training","457086","04149700"
"Hope International University","2500 E Nutwood Ave, Fullerton, California 92831-3199","www.hiu.edu","4-year, Private not-for-profit","Less than one year certificate|One but less than two years certificate|Associate's degree|Bachelor's degree|Postbaccalaureate certificate|Master's degree","Suburb: Large","Yes","1253","743","44%","37%","Fall 2012","$22,354","-","120537","00125200"
"Howard University","2400 Sixth St NW, Washington, District of Columbia 20059-0001","www.howard.edu","4-year, Private not-for-profit","Two but less than 4 years certificate|Bachelor's degree|Postbaccalaureate certificate|Master's degree|Post-master's certificate|Doctor's degree - research/scholarship|Doctor's degree - professional practice","City: Large","Yes","9139","6243","62%","26%","Fall 2012","$19,196","-","131520","00144800"
"Humboldt State University","1 Harpst Street, Arcata, California 95521-8299","www.humboldt.edu","4-year, Public","Bachelor's degree|Postbaccalaureate certificate|Master's degree","Town: Remote","Yes","7972","7319","52%","4%","Fall 2012","$14,506","-","115755","00114900"
"Humphreys College-Modesto","3600 Sisk Rd Ste 5A, Modesto, California 95356-0532","humphreys.edu","4-year, Private not-for-profit","Associate's degree|Bachelor's degree|Master's degree","City: Midsize","No","","","NA","NA","Fall 2012","NA","-","11577301","00121203"
"Humphreys University-Stockton and Modesto Campuses","6650 Inglewood Ave, Stockton, California 95207-3896","www.humphreys.edu","4-year, Private not-for-profit","Associate's degree|Two but less than 4 years certificate|Bachelor's degree|Master's degree|Doctor's degree - professional practice","City: Large","No","463","317","38%","33%","Fall 2012","$7,139","-","115773","00121200"
"Huntingdon College","1500 East Fairview Avenue, Montgomery, Alabama 36106-2148","www.huntingdon.edu","4-year, Private not-for-profit","Bachelor's degree","City: Midsize","Yes","1081","1081","43%","NA","Fall 2012","$20,893","-","101435","00101900"
"Huntsville Bible College","906 Oakwood Ave, Huntsville, Alabama 35811-1632","www.hbc1.edu","4-year, Private not-for-profit","One but less than two years certificate|Associate's degree|Bachelor's degree|Master's degree","City: Midsize","No","128","105","33%","NA","Fall 2012","$5,530","-","449348","03894300"
"Iliff School of Theology","2323 E. Iliff Ave., Denver, Colorado 80210-4798","www.iliff.edu","4-year, Private not-for-profit","Postbaccalaureate certificate|Master's degree|Doctor's degree - research/scholarship","City: Large","No","263","","NA","NA","Fall 2012","NA","-","127273","00135400"
"Ilisagvik College","Narl Facility, Barrow, Alaska 99723","www.ilisagvik.edu","4-year, primarily associate's, Public","Less than one year certificate|One but less than two years certificate|Associate's degree|Bachelor's degree","Rural: Fringe","Yes","335","335","13%","53%","Fall 2012","$10,986","-","434584","03461300"
"Institute of Buddhist Studies","2140 Durant Avenue, Berkeley, California 94704","www.shin-ibs.edu","4-year, Private not-for-profit","Postbaccalaureate certificate|Master's degree","City: Midsize","Yes","22","","NA","NA","Fall 2012","NA","-","489335",""
"Institute of Taoist Education and Acupuncture","317 W South Boulder Rd, Suite 5, Louisville, Colorado 80027","www.itea.edu","4-year, Private not-for-profit","Master's degree","Suburb: Small","No","26","","NA","NA","Fall 2012","NA","-","454838","04121200"
"Institute of World Politics","1521 16th St NW, Washington, District of Columbia 20036","www.iwp.edu/","4-year, Private not-for-profit","Postbaccalaureate certificate|Master's degree|Doctor's degree","City: Large","No","141","","NA","NA","Fall 2012","NA","-","455804","04114400"
"International Baptist College and Seminary","2211 W Germann Road, Chandler, Arizona 85286","www.ibcs.edu/ibc/","4-year, Private not-for-profit","Less than one year certificate|Associate's degree|Bachelor's degree|Master's degree|Doctor's degree","Suburb: Large","Yes","78","46","60%","40%","Fall 2012","$14,546","-","436614","03347300"
"International Technological University","2711 North First Street, San Jose, California 95134","itu.edu","4-year, Private not-for-profit","Master's degree|Doctor's degree - research/scholarship","City: Large","No","558","","NA","NA","Fall 2012","NA","-","443128",""
"Irell & Manella Graduate School of Biological Sciences at City of Hope","1500 East Duarte Road, Duarte, California 91010-3000","https://www.cityofhope.org/grad-school","4-year, Private not-for-profit","Master's degree|Doctor's degree - research/scholarship","Suburb: Large","Yes","90","","NA","NA","Fall 2012","NA","-","441238","03592400"
"Jacksonville State University","700 Pelham Road North, Jacksonville, Alabama 36265","www.jsu.edu/","4-year, Public","Bachelor's degree|Postbaccalaureate certificate|Master's degree|Post-master's certificate|Doctor's degree - research/scholarship|Doctor's degree - professional practice","City: Small","Yes","8479","7321","42%","34%","Fall 2012","$12,243","-","101480","00102000"
"Jesuit School of Theology of Santa Clara University","1735 LeRoy Ave, Berkeley, California 94709","www.scu.edu/jst","4-year, Private not-for-profit","Master's degree|Doctor's degree - professional practice","City: Midsize","","","","NA","NA","Fall 2012","NA","-","12293101","00132604"
"John Brown University","2000 W University St, Siloam Springs, Arkansas 72761","www.jbu.edu","4-year, Private not-for-profit","Associate's degree|Bachelor's degree|Master's degree|Post-master's certificate","Town: Distant","Yes","2516","1903","66%","21%","Fall 2012","$22,390","-","107141","00110000"
"John F. Kennedy University","100 Ellinwood Way, Pleasant Hill, California 94523-4817","https://www.jfku.edu","4-year, Private not-for-profit","Less than one year certificate|One but less than two years certificate|Bachelor's degree|Postbaccalaureate certificate|Master's degree|Post-master's certificate|Doctor's degree - professional practice","Suburb: Large","No","975","210","NA","NA","Fall 2012","NA","-","116712","00448400"
"John Paul the Great Catholic University","155 W. Grand Ave, Escondido, California 92025","https://jpcatholic.edu/","4-year, Private not-for-profit","Bachelor's degree|Postbaccalaureate certificate|Master's degree","Suburb: Large","Yes","308","286","64%","NA","Fall 2012","$29,168","-","462354","04193700"
"Johnson & Wales University-Denver","7150 Montview Blvd, Denver, Colorado 80220","www.jwu.edu/campuses/denver/index.html","4-year, Private not-for-profit","Associate's degree|Bachelor's degree|Master's degree","City: Large","Yes","1008","974","66%","NA","Fall 2012","$25,941","-","439288","00340409"
"Judson College","302 Bibb St, Marion, Alabama 36756","www.judson.edu","4-year, Private not-for-profit","Associate's degree|Bachelor's degree","Rural: Remote","Yes","268","268","35%","43%","Fall 2012","$16,348","-","101541","00102300"
"Keck Graduate Institute","535 Watson Dr, Claremont, California 91711","www.kgi.edu","4-year, Private not-for-profit","Postbaccalaureate certificate|Master's degree|Post-master's certificate|Doctor's degree - research/scholarship|Doctor's degree - professional practice","Suburb: Large","Yes","617","","NA","NA","Fall 2012","NA","-","440031","03853300"
"La Sierra University","4500 Riverwalk Parkway, Riverside, California 92505-8247","https://lasierra.edu","4-year, Private not-for-profit","Less than one year certificate|One but less than two years certificate|Two but less than 4 years certificate|Bachelor's degree|Postbaccalaureate certificate|Master's degree|Post-master's certificate|Doctor's degree - research/scholarship","City: Large","Yes","2339","1825","45%","NA","Fall 2012","$21,451","-","117627","00121500"
"Laguna College of Art and Design","2222 Laguna Canyon Rd, Laguna Beach, California 92651","www.lcad.edu","4-year, Private not-for-profit","Two but less than 4 years certificate|Bachelor's degree|Postbaccalaureate certificate|Master's degree","Rural: Fringe","Yes","758","705","61%","NA","Fall 2012","$36,133","-","117168","02330500"
"Life Chiropractic College West","25001 Industrial Blvd, Hayward, California 94545-2800","www.lifewest.edu","4-year, Private not-for-profit","Doctor's degree - professional practice","City: Midsize","No","637","","NA","NA","Fall 2012","NA","-","117520","02228500"
"Life Pacific College","1100 W. Covina Blvd., San Dimas, California 91773-3298","www.lifepacific.edu","4-year, Private not-for-profit","Associate's degree|Bachelor's degree|Master's degree","Suburb: Large","Yes","619","530","41%","NA","Fall 2012","$19,223","-","117104","02270600"
"Lincoln University","401 15th Street, Oakland, California 94612-2801","www.lincolnuca.edu","4-year, Private not-for-profit","Two but less than 4 years certificate|Bachelor's degree|Master's degree|Doctor's degree - research/scholarship","City: Large","No","573","92","74%","NA","Fall 2012","$18,995","-","117557","00697500"
"Loma Linda University","11139 Anderson Street, Loma Linda, California 92350","www.llu.edu/index.html","4-year, Private not-for-profit","Less than one year certificate|One but less than two years certificate|Associate's degree|Two but less than 4 years certificate|Bachelor's degree|Postbaccalaureate certificate|Master's degree|Post-master's certificate|Doctor's degree - research/scholarship|Doctor's degree - professional practice|Doctor's degree - other","Suburb: Large","Yes","4448","1192","NA","NA","Fall 2012","NA","-","117636","00121800"
"Los Angeles Center","6701 Center Drive West #1200, Los Angeles, California 90045-1746","www.myunion.edu","4-year, Private not-for-profit","Bachelor's degree|Postbaccalaureate certificate|Master's degree|Doctor's degree - research/scholarship","City: Large","No","","","NA","NA","Fall 2012","NA","-","20627901","01092303"
"Los Angeles Pacific University","300 N Lone Hill Avenue, #200, San Dimas, California 91773-1741","https://www.lapu.edu","4-year, Private not-for-profit","Less than one year certificate|Associate's degree|Bachelor's degree|Master's degree","Suburb: Large","No","2360","1924","25%","36%","Fall 2012","$19,936","-","474863","04278800"
"Loyola Marymount University","One Lmu Drive, Los Angeles, California 90045-2659","www.lmu.edu","4-year, Private not-for-profit","Bachelor's degree|Postbaccalaureate certificate|Master's degree|Post-master's certificate|Doctor's degree - research/scholarship|Doctor's degree - professional practice","City: Large","Yes","9838","6700","84%","NA","Fall 2012","$43,779","-","117946","01164900"
"Lyon College","2300 Highland Road, Batesville, Arkansas 72501","www.lyon.edu","4-year, Private not-for-profit","Bachelor's degree","Town: Remote","Yes","655","655","49%","39%","Fall 2012","$15,176","-","106342","00108800"
"Marshall B Ketchum University","2575 Yorba Linda Blvd, Fullerton, California 92831-1699","www.ketchum.edu","4-year, Private not-for-profit","Master's degree|Doctor's degree - professional practice","Suburb: Large","Yes","681","","NA","NA","Fall 2012","NA","-","123943","00123000"
"Marymount California University","30800 Palos Verdes Drive East, Rancho Palos Verdes, California 90275-6299","www.marymountcalifornia.edu/","4-year, primarily associate's, Private not-for-profit","Associate's degree|Bachelor's degree|Master's degree","Suburb: Large","Yes","761","735","33%","51%","Fall 2012","$28,978","-","118541","01047400"
"Marymount California University - Lakeside Campus","3700 Country Club Dr., Lucerne, California 95458-0000","www.marymountcalifornia.edu/lakeside/explore","4-year, Private not-for-profit","Bachelor's degree|Master's degree","Town: Distant","No","","","NA","NA","Fall 2012","NA","-","11854102",""
"Marymount University - Waterfront Campus","222 West Sixth Street, San Pedro, California 90731-3316","www.marymountcalifornia.edu","4-year, Private not-for-profit","Associate's degree|Bachelor's degree|Master's degree","City: Large","No","","","NA","NA","Fall 2012","NA","-","11854101",""
"Mayo Clinic College of Medicine and Science - Arizona","13400 East Shea Boulevard, Scottsdale, Arizona 85259","www.mayo.edu/education","4-year, Private not-for-profit","One but less than two years certificate|Postbaccalaureate certificate|Doctor's degree - professional practice","City: Midsize","","","","NA","NA","Fall 2012","NA","-","17395702",""
"Menlo College","1000 El Camino Real, Atherton, California 94027-4301","www.menlo.edu","4-year, Private not-for-profit","Bachelor's degree","Suburb: Large","Yes","775","775","59%","NA","Fall 2012","$26,699","-","118693","00123600"
"Metropolitan State University of Denver","Speer Blvd and Colfax Ave, Denver, Colorado 80217-3362","www.msudenver.edu/","4-year, Public","Less than one year certificate|Bachelor's degree|Postbaccalaureate certificate|Master's degree","City: Large","No","20192","19437","28%","30%","Fall 2012","$15,248","-","127565","00136000"
"Middlebury Institute of International Studies at Monterey","460 Pierce Street, Monterey, California 93940","www.middlebury.edu/institute/","4-year, Private not-for-profit","Bachelor's degree|Postbaccalaureate certificate|Master's degree","Suburb: Midsize","No","670","5","NA","NA","Fall 2012","NA","-","119058","00369110"
"Midwestern University-Glendale","19555 N 59th Ave, Glendale, Arizona 85308","www.midwestern.edu","4-year, Private not-for-profit","Master's degree|Doctor's degree - professional practice","Suburb: Large","Yes","3823","","NA","NA","Fall 2012","NA","-","423643","00165701"
"Miles College","5500 Myron Massey Blvd, Fairfield, Alabama 35064-2621","www.miles.edu","4-year, Private not-for-profit","Bachelor's degree","Suburb: Large","Yes","1550","1550","24%","NA","Fall 2012","$15,246","-","101675","00102800"
"Mills College","5000 MacArthur Blvd, Oakland, California 94613","https://www.mills.edu","4-year, Private not-for-profit","Two but less than 4 years certificate|Bachelor's degree|Postbaccalaureate certificate|Master's degree|Doctor's degree - research/scholarship","City: Large","Yes","1257","768","74%","NA","Fall 2012","$24,900","-","118888","00123800"
"Minerva Schools at Keck Graduate Institute","535 Watson Drive, Claremont, California 91711","https://www.minerva.kgi.edu","4-year, Private not-for-profit","Bachelor's degree|Master's degree","City: Large","Yes","","","NA","NA","Fall 2012","NA","-","484844",""
"MiraCosta College","One Barnard Drive, Oceanside, California 92056-3899","www.miracosta.edu","4-year, primarily associate's, Public","Less than one year certificate|One but less than two years certificate|Associate's degree|Bachelor's degree","Suburb: Large","No","13720","13720","30%","15%","Fall 2012","$5,524","-","118912","00123900"
"MiraCosta College - San Elijo Campus","3333 Manchester Avenue, Cardiff, California 92007-1516","miracosta.edu","4-year, Public","Less than one year certificate|One but less than two years certificate|Associate's degree|Bachelor's degree","Suburb: Large","No","","","NA","NA","Fall 2012","NA","-","11891201","00123901"
"Mitchell College","437 Pequot Avenue, New London, Connecticut 06320","www.mitchell.edu","4-year, Private not-for-profit","Less than one year certificate|Associate's degree|Bachelor's degree","City: Small","Yes","665","665","45%","43%","Fall 2012","$28,002","-","129774","00139300"
"Modesto Junior College","435 College Ave, Modesto, California 95350-5800","www.mjc.edu","4-year, primarily associate's, Public","Less than one year certificate|One but less than two years certificate|Associate's degree|Bachelor's degree","City: Midsize","No","17908","17908","22%","15%","Fall 2012","$9,586","-","118976","00124000"
"Montessori Education Center of the Rockies","4745 Walnut Street, Boulder, Colorado 80301","www.mecr.edu","4-year, Private not-for-profit","One but less than two years certificate|Postbaccalaureate certificate","City: Midsize","No","63","17","100%","NA","Fall 2012","$13,327","Montessori Teacher Education","127954","03306300"
"Mount Saint Mary's University","12001 Chalon Rd, Los Angeles, California 90049-1599","https://www.msmu.edu","4-year, Private not-for-profit","Less than one year certificate|Associate's degree|Bachelor's degree|Postbaccalaureate certificate|Master's degree|Post-master's certificate|Doctor's degree - professional practice","City: Large","Yes","2965","2356","64%","30%","Fall 2012","$29,563","-","119173","00124300"
"Mount Saint Mary's University - Doheny Campus","10 Chester Place, Los Angeles, California 90007","www.msmu.edu","4-year, Private not-for-profit","Less than one year certificate|Associate's degree|Bachelor's degree|Postbaccalaureate certificate|Master's degree|Post-master's certificate|Doctor's degree - professional practice","City: Large","Yes","","","NA","NA","Fall 2012","NA","-","11917301","00124301"
"Naropa University","2130 Arapahoe Ave, Boulder, Colorado 80302-6697","www.naropa.edu","4-year, Private not-for-profit","One but less than two years certificate|Bachelor's degree|Master's degree","City: Midsize","Yes","953","419","42%","25%","Fall 2012","$25,220","-","127653","02117500"
"National University","11255 North Torrey Pines Road, La Jolla, California 92037-1011","www.nu.edu","4-year, Private not-for-profit","Less than one year certificate|Associate's degree|Bachelor's degree|Postbaccalaureate certificate|Master's degree|Post-master's certificate","City: Large","No","16930","7735","36%","20%","Fall 2012","NA","-","119605","01146000"
"Naval Postgraduate School","1 University Circle, Monterey, California 93943","https://www.nps.edu","4-year, Public","Postbaccalaureate certificate|Master's degree|Post-master's certificate|Doctor's degree - research/scholarship","Suburb: Midsize","No","2737","","NA","NA","Fall 2012","NA","-","119678","00131000"
"Nazarene Bible College","1111 Academy Park Loop, Colorado Springs, Colorado 80910","www.nbc.edu","4-year, Private not-for-profit","Less than one year certificate|One but less than two years certificate|Associate's degree|Bachelor's degree","City: Large","No","731","731","0%","100%","Fall 2012","NA","-","127714","01300700"
"Northern Arizona University","1900 S Knoles Dr, Babbitt Administrative Center, Room 200, Flagstaff, Arizona 86011-4092","https://nau.edu/","4-year, Public","Less than one year certificate|One but less than two years certificate|Bachelor's degree|Postbaccalaureate certificate|Master's degree|Post-master's certificate|Doctor's degree - research/scholarship|Doctor's degree - professional practice","City: Small","Yes","31066","27072","52%","NA","Fall 2012","$14,882","-","105330","00108200"
"Notre Dame de Namur University","1500 Ralston Ave, Belmont, California 94002-1908","www.ndnu.edu","4-year, Private not-for-profit","Bachelor's degree|Postbaccalaureate certificate|Master's degree|Doctor's degree - research/scholarship","Suburb: Large","Yes","1492","871","49%","43%","Fall 2012","$26,913","-","120184","00117900"
"Oakwood University","7000 Adventist Blvd NW, Huntsville, Alabama 35896","https://www2.oakwood.edu","4-year, Private not-for-profit","Associate's degree|Bachelor's degree|Postbaccalaureate certificate|Master's degree","City: Midsize","Yes","1636","1581","48%","12%","Fall 2012","$25,938","-","101912","00103300"
"Occidental College","1600 Campus Rd, Los Angeles, California 90041-3392","https://www.oxy.edu","4-year, Private not-for-profit","Bachelor's degree|Master's degree","City: Large","Yes","1930","1930","85%","11%","Fall 2012","$37,173","-","120254","00124900"
"Oikos University","7850 Edgewater Drive, Oakland, California 94621-2041","www.oikos.edu","4-year, Private not-for-profit","Bachelor's degree|Master's degree","City: Large","No","86","62","NA","NA","Fall 2012","NA","-","491491","04238300"
"Otis College of Art and Design","9045 Lincoln Blvd, Los Angeles, California 90045-3505","www.otis.edu","4-year, Private not-for-profit","Bachelor's degree|Master's degree","City: Large","Yes","1144","1086","57%","NA","Fall 2012","$44,855","-","120403","00125100"
"Ottawa University-Phoenix","9414 North 25th Avenue, Phoenix, Arizona 85021","www.ottawa.edu","4-year, Private not-for-profit","Bachelor's degree|Master's degree|Post-master's certificate","City: Large","No","809","344","NA","NA","Fall 2012","NA","-","105367","00193701"
"Ottawa University-Surprise","15950 N. Civic Center Plaza, Surprise, Arizona 85374","www.ottawa.edu/ouaz/home/","4-year, Private not-for-profit","Bachelor's degree|Master's degree","Suburb: Large","Yes","655","598","NA","NA","Fall 2012","$27,064","-","464226","00193722"
"Ouachita Baptist University","410 Ouachita St, Arkadelphia, Arkansas 71998-0001","www.obu.edu","4-year, Private not-for-profit","Associate's degree|Bachelor's degree","Town: Distant","Yes","1660","1660","64%","NA","Fall 2012","$18,679","-","107512","00110200"
"Pacific Oaks College","55 Eureka Street, Pasadena, California 91103","www.pacificoaks.edu","4-year, Private not-for-profit","Bachelor's degree|Postbaccalaureate certificate|Master's degree","City: Midsize","No","1111","476","NA","NA","Fall 2012","NA","-","120768","00125500"
"Pacific School of Religion","1798 Scenic Ave, Berkeley, California 94709","www.psr.edu","4-year, Private not-for-profit","Postbaccalaureate certificate|Master's degree|Post-master's certificate|Doctor's degree","City: Midsize","Yes","95","","NA","NA","Fall 2012","NA","-","120795","00125600"
"Pacific States University","3424 Wilshire Blvd. 12th floor, Los Angeles, California 90010-2263","www.psuca.edu","4-year, Private not-for-profit","Bachelor's degree|Postbaccalaureate certificate|Master's degree","City: Large","No","62","6","14%","57%","Fall 2012","NA","-","120838","03163300"
"Pacific Union College","One Angwin Ave, Angwin, California 94508-9707","www.puc.edu","4-year, Private not-for-profit","Less than one year certificate|Associate's degree|Bachelor's degree|Master's degree","Rural: Fringe","Yes","1062","1058","55%","29%","Fall 2012","$23,005","-","120865","00125800"
"Palo Alto University","1791 Arastradero Rd, Palo Alto, California 94304-1337","www.paloaltou.edu","4-year, Private not-for-profit","Bachelor's degree|Master's degree|Doctor's degree - professional practice","Rural: Fringe","No","1071","102","NA","NA","Fall 2012","NA","-","120698","02138300"
"Pardee RAND Graduate School","1776 Main St, Santa Monica, California 90401-3208","www.prgs.edu","4-year, Private not-for-profit","Master's degree|Doctor's degree - research/scholarship","City: Small","No","110","","NA","NA","Fall 2012","NA","-","121628","01044100"
"Pepperdine University","24255 Pacific Coast Hwy, Malibu, California 90263","www.pepperdine.edu/","4-year, Private not-for-profit","Bachelor's degree|Postbaccalaureate certificate|Master's degree|Doctor's degree - research/scholarship|Doctor's degree - professional practice","Suburb: Large","Yes","7961","3627","83%","NA","Fall 2012","$40,941","-","121150","01014900"
"Philander Smith College","900 W. Daisy Bates Drive, Little Rock, Arkansas 72202-3799","https://www.philander.edu","4-year, Private not-for-profit","Bachelor's degree","City: Midsize","Yes","1000","1000","41%","NA","Fall 2012","$13,694","-","107600","00110300"
"Phoenix Seminary","7901 E. Shea Blvd., Scottsdale, Arizona 85260","www.ps.edu/","4-year, Private not-for-profit","Postbaccalaureate certificate|Master's degree|Doctor's degree - research/scholarship","City: Midsize","No","250","","NA","NA","Fall 2012","NA","-","381459","03478400"
"Pikes Peak Community College","5675 S Academy Blvd, Colorado Springs, Colorado 80906-5498","www.ppcc.edu","4-year, primarily associate's, Public","Less than one year certificate|One but less than two years certificate|Associate's degree|Bachelor's degree","Suburb: Large","No","13204","13204","18%","20%","Fall 2012","$8,858","-","127820","00889600"
