"Name","Address","Website","Type","Awards offered","Campus setting","Campus housing","Student population","Undergraduate students","Graduation Rate","Transfer-Out Rate","Cohort Year *","Net Price **","Largest Program","IPEDS ID","OPE ID"
"California University of Management and Sciences","721 N Euclid St, Anaheim, California 92801","www.calums.edu","4-year, Private not-for-profit","Bachelor's degree|Master's degree","City: Large","No","20","","NA","NA","Fall 2012","NA","-","460075",""
"California Western School of Law","225 Cedar St, San Diego, California 92101-3046","https://www.cwsl.edu","4-year, Private not-for-profit","Master's degree|Doctor's degree - professional practice","City: Large","No","802","","NA","NA","Fall 2012","NA","-","111391","01310300"
"Catholic University of America","620 Michigan Avenue, NE, Washington, District of Columbia 20064","https://www.catholic.edu","4-year, Private not-for-profit","One but less than two years certificate|Associate's degree|Bachelor's degree|Postbaccalaureate certificate|Master's degree|Post-master's certificate|Doctor's degree - research/scholarship|Doctor's degree - professional practice","City: Large","Yes","5956","3332","76%","NA","Fall 2012","$36,080","-","131283","00143700"
"Central Baptist College","1501 College Avenue, Conway, Arkansas 72034","www.cbc.edu","4-year, Private not-for-profit","Associate's degree|Bachelor's degree","City: Small","Yes","732","732","34%","40%","Fall 2012","$16,517","-","106713","00109300"
"Central Connecticut State University","1615 Stanley St, New Britain, Connecticut 06050","www2.ccsu.edu/","4-year, Public","Bachelor's degree|Postbaccalaureate certificate|Master's degree|Post-master's certificate|Doctor's degree - research/scholarship|Doctor's degree - professional practice","Suburb: Large","Yes","11822","9546","51%","NA","Fall 2012","$15,469","-","128771","00137800"
"Champion Christian College","600 Garland Avenue, Hot Springs, Arkansas 71913","championchristiancollege.com","4-year, Private not-for-profit","Associate's degree|Two but less than 4 years certificate|Bachelor's degree","City: Small","Yes","87","87","18%","24%","Fall 2012","NA","-","492069","04276100"
"Chapman University","One University Dr., Orange, California 92866","https://www.chapman.edu","4-year, Private not-for-profit","Less than one year certificate|Bachelor's degree|Master's degree|Doctor's degree - research/scholarship|Doctor's degree - professional practice","City: Midsize","Yes","9608","7281","79%","NA","Fall 2012","$41,463","-","111948","00116400"
"Charles R Drew University of Medicine and Science","1731 E 120th St, Los Angeles, California 90059","www.cdrewu.edu","4-year, Private not-for-profit","Associate's degree|Bachelor's degree|Postbaccalaureate certificate|Master's degree|Post-master's certificate","Suburb: Large","No","596","169","100%","NA","Fall 2012","$22,613","-","111966","01036500"
"Charter Oak State College","55 Paul Manafort Drive, New Britain, Connecticut 06053","https://www.charteroak.edu","4-year, Public","Less than one year certificate|One but less than two years certificate|Associate's degree|Bachelor's degree|Master's degree","Suburb: Large","No","1641","1549","NA","NA","Fall 2012","NA","-","128780","03234300"
"Church Divinity School of the Pacific","2451 Ridge Road, Berkeley, California 94709-1211","www.cdsp.edu","4-year, Private not-for-profit","Postbaccalaureate certificate|Master's degree","City: Midsize","Yes","87","","NA","NA","Fall 2012","NA","-","112127","00116500"
"Claremont Graduate University","150 E Tenth St, Claremont, California 91711-6160","www.cgu.edu","4-year, Private not-for-profit","Postbaccalaureate certificate|Master's degree|Doctor's degree - research/scholarship","Suburb: Large","Yes","1882","","NA","NA","Fall 2012","NA","-","112251","00116900"
"Claremont Lincoln University","250 West First Street Suite 330, Claremont, California 91711-4744","https://claremontlincoln.edu","4-year, Private not-for-profit","Master's degree","Suburb: Large","No","116","","NA","NA","Fall 2012","NA","-","488387","04253600"
"Claremont McKenna College","500 E 9th St, Claremont, California 91711-6400","www.cmc.edu","4-year, Private not-for-profit","Bachelor's degree|Master's degree","Suburb: Large","Yes","1327","1324","93%","NA","Fall 2012","$26,512","-","112260","00117000"
"Claremont School of Theology","1325 N College Ave, Claremont, California 91711-3199","www.cst.edu","4-year, Private not-for-profit","Master's degree|Doctor's degree - research/scholarship|Doctor's degree - professional practice","Suburb: Large","Yes","385","","NA","NA","Fall 2012","NA","-","124283","00128800"
"CollegeAmerica-Colorado Springs","3645 Citadel Drive South, Colorado Springs, Colorado 80909","www.collegeamerica.edu/","4-year, primarily associate's, Private not-for-profit","Associate's degree|Bachelor's degree","City: Large","No","143","143","34%","NA","Fall 2012","$25,355","-","448752","02594302"
"CollegeAmerica-Flagstaff","399 Malpais, Flagstaff, Arizona 86001","www.collegeamerica.edu","4-year, primarily associate's, Private not-for-profit","Associate's degree|Bachelor's degree","City: Small","No","62","62","30%","NA","Fall 2012","$26,908","-","103945","03120300"
"CollegeAmerica-Fort Collins","4601 South Mason St, Fort Collins, Colorado 80525","www.collegeamerica.edu","4-year, primarily associate's, Private not-for-profit","Associate's degree|Bachelor's degree","City: Midsize","No","113","113","33%","NA","Fall 2012","$24,789","-","448761","02594301"
"CollegeAmerica-Phoenix","9801 N. Metro Parkway East, Phoenix, Arizona 85051","www.collegeamerica.edu","4-year, primarily associate's, Private not-for-profit","Associate's degree|Bachelor's degree","City: Large","No","488","488","38%","NA","Fall 2012","$24,616","-","474890","03120301"
"Colorado Christian University","8787 West Alameda Avenue, Lakewood, Colorado 80226","WWW.CCU.EDU","4-year, Private not-for-profit","Less than one year certificate|One but less than two years certificate|Associate's degree|Bachelor's degree|Postbaccalaureate certificate|Master's degree","City: Midsize","Yes","7625","6677","52%","NA","Fall 2012","$25,031","-","126669","00940100"
"Colorado College","14. E Cache La Poudre St., Colorado Springs, Colorado 80903","www.coloradocollege.edu","4-year, Private not-for-profit","Bachelor's degree|Master's degree","City: Large","Yes","2144","2114","89%","NA","Fall 2012","$28,390","-","126678","00134700"
"Colorado Mesa University","1100 North Avenue, Grand Junction, Colorado 81501-3122","www.coloradomesa.edu","4-year, Public","Less than one year certificate|One but less than two years certificate|Associate's degree|Bachelor's degree|Postbaccalaureate certificate|Master's degree|Doctor's degree - professional practice","City: Small","Yes","9492","9365","36%","29%","Fall 2012","$14,403","-","127556","00135800"
"Colorado Mountain College","802 Grand Ave., Glenwood Springs, Colorado 81601-0233","coloradomtn.edu/","4-year, primarily associate's, Public","Less than one year certificate|One but less than two years certificate|Associate's degree|Bachelor's degree","Town: Remote","Yes","5688","5688","21%","36%","Fall 2012","$5,818","-","126711","00450600"
"Colorado School of Mines","1500 Illinois St, Golden, Colorado 80401","www.mines.edu","4-year, Public","Bachelor's degree|Master's degree|Post-master's certificate|Doctor's degree - research/scholarship","Suburb: Large","Yes","6325","4952","80%","7%","Fall 2012","$25,767","-","126775","00134800"
"Colorado State University-Fort Collins","102 Administration Building, Fort Collins, Colorado 80523-0100","www.colostate.edu","4-year, Public","Bachelor's degree|Postbaccalaureate certificate|Master's degree|Doctor's degree - research/scholarship|Doctor's degree - professional practice","City: Midsize","Yes","33478","25962","71%","8%","Fall 2012","$17,914","-","126818","00135000"
"Colorado State University-Global Campus","7800 East Orchard Road Ste 200, Greenwood Village, Colorado 80111-0000","https://csuglobal.edu","4-year, Public","Less than one year certificate|Bachelor's degree|Postbaccalaureate certificate|Master's degree","Suburb: Large","No","12476","8054","NA","NA","Fall 2012","NA","-","476975","04208700"
"Colorado State University-Pueblo","2200 Bonforte Blvd, Pueblo, Colorado 81001-4901","https://www.csupueblo.edu","4-year, Public","Bachelor's degree|Master's degree","City: Midsize","Yes","6736","4385","32%","57%","Fall 2012","$12,243","-","128106","00136500"
"Columbia College - Coast Guard Island","Building #3, Alameda, California 94501-5100","www.ccis.edu","4-year, Private not-for-profit","Associate's degree|Bachelor's degree|Master's degree","Suburb: Large","No","","","NA","NA","Fall 2012","NA","-","17706502","00245604"
"Columbia College - Denver","6892 S. Yosemite Ct Suite 3-100, Centennial, Colorado 80112-1464","www.ccis.edu","4-year, Private not-for-profit","Associate's degree|Bachelor's degree|Master's degree","Suburb: Large","No","","","NA","NA","Fall 2012","NA","-","17706503","00245605"
"Columbia College - Lemoore","Building 826 Hancock Circle, NAS Lemoore, California 93246-0001","www.ccis.edu","4-year, Private not-for-profit","Associate's degree|Bachelor's degree|Master's degree","Town: Fringe","No","","","NA","NA","Fall 2012","NA","-","17706521","00245636"
"Columbia College - Los Alamitos","11206 Lexington Avenue, Suite 110, Los Alamitos, California 90720-5177","www.ccis.edu","4-year, Private not-for-profit","Associate's degree|Bachelor's degree","Suburb: Large","No","","","NA","NA","Fall 2012","NA","-","17706519","00245629"
"Columbia College - Redstone Arsenal","Army Education Ctr, Bldg 3495, #106, Redstone Arsenal, Alabama 35898-5192","www.ccis.edu","4-year, Private not-for-profit","Associate's degree|Bachelor's degree|Master's degree","Suburb: Large","No","","","NA","NA","Fall 2012","NA","-","17706501","00245602"
"Columbia College - San Diego","4025 Tripoli Avenue, San Diego, California 92140-5290","www.ccis.edu","4-year, Private not-for-profit","Associate's degree|Bachelor's degree","City: Large","No","","","NA","NA","Fall 2012","NA","-","17706532","00245648"
"Columbia College - San Luis Obispo","Building 2700 A at Cuesta College, San Luis Obispo, California 93403-8106","www.ccis.edu","4-year, Private not-for-profit","Bachelor's degree","Suburb: Small","No","","","NA","NA","Fall 2012","NA","-","17706522","00245637"
"Columbia College Hollywood","18618 Oxnard St, Tarzana, California 91356-1411","https://www.columbiacollege.edu","4-year, Private not-for-profit","Associate's degree|Bachelor's degree","City: Large","No","540","540","50%","NA","Fall 2012","$33,490","-","112570","02110200"
"Community College of Denver","1111 W. Colfax Ave., Denver, Colorado 80204-2026","www.ccd.edu","4-year, primarily associate's, Public","Less than one year certificate|One but less than two years certificate|Associate's degree|Bachelor's degree","City: Large","No","7887","7887","13%","13%","Fall 2012","$6,736","-","126942","00954200"
"Concordia University-Irvine","1530 Concordia West, Irvine, California 92612-3203","www.cui.edu","4-year, Private not-for-profit","Associate's degree|Bachelor's degree|Postbaccalaureate certificate|Master's degree|Doctor's degree - research/scholarship","City: Large","Yes","4162","1788","63%","NA","Fall 2012","$28,588","-","112075","02070500"
"Connecticut College","270 Mohegan Avenue, New London, Connecticut 06320-4196","www.conncoll.edu","4-year, Private not-for-profit","Bachelor's degree|Master's degree","City: Small","Yes","1844","1844","81%","NA","Fall 2012","$38,890","-","128902","00137900"
"Crowley's Ridge College","100 College Dr, Paragould, Arkansas 72450","www.crc.edu/","4-year, Private not-for-profit","Associate's degree|Bachelor's degree","Rural: Fringe","Yes","198","198","44%","24%","Fall 2012","$13,042","-","106810","00109500"
"Culinary Institute of America at Greystone","2555 Main St, St. Helena, California 94574","www.ciachef.edu","4-year, Private not-for-profit","One but less than two years certificate|Associate's degree|Postbaccalaureate certificate","Town: Fringe","Yes","","","NA","NA","Fall 2012","NA","-","19050301","00730401"
"Cypress College","9200 Valley View, Cypress, California 90630-5897","www.cypresscollege.edu","4-year, primarily associate's, Public","Less than one year certificate|One but less than two years certificate|Associate's degree|Two but less than 4 years certificate|Bachelor's degree","Suburb: Large","No","15794","15794","30%","18%","Fall 2012","$6,303","-","113236","00119300"
"Daniel Morgan Graduate School of National Security","1620 L Street, NW, Washington, District of Columbia 20036-5699","dmgs.org/","4-year, Private not-for-profit","Postbaccalaureate certificate|Master's degree","City: Large","No","52","","NA","NA","Fall 2012","NA","-","492102",""
"Delaware State University","1200 N. Dupont Highway, Dover, Delaware 19901","www.desu.edu","4-year, Public","Less than one year certificate|Bachelor's degree|Master's degree|Doctor's degree - research/scholarship","City: Small","Yes","4586","4208","40%","NA","Fall 2012","$13,234","-","130934","00142800"
"Delaware Technical Community College-Owens","Route 18, Seashore Highway PO Box 610, Georgetown, Delaware 19947","https://www.dtcc.edu/our-campuses/georgetown","4-year, Public","Less than one year certificate|One but less than two years certificate|Associate's degree|Bachelor's degree","Town: Fringe","No","","","NA","NA","Fall 2012","NA","-","13090701","01172702"
"Delaware Technical Community College-Stanton/Wilmington","333 N. Shipley Street, Wilmington, Delaware 19801","https://www.dtcc.edu/our-campuses/wilmington","4-year, Public","Less than one year certificate|One but less than two years certificate|Associate's degree|Bachelor's degree","City: Small","No","","","NA","NA","Fall 2012","NA","-","13090702","01172703"
"Delaware Technical Community College-Terry","100 Campus Drive, Dover, Delaware 19901","https://www.dtcc.edu","4-year, primarily associate's, Public","Less than one year certificate|One but less than two years certificate|Associate's degree|Bachelor's degree","City: Small","No","13895","13895","14%","9%","Fall 2012","$8,261","-","130907","01172700"
"Dell'Arte International School of Physical Theatre","131 H Street, Blue Lake, California 95525-0816","www.dellarte.com/school","4-year, Private not-for-profit","One but less than two years certificate|Two but less than 4 years certificate|Master's degree","Rural: Fringe","No","30","10","NA","NA","Fall 2012","NA","-","113537","03025600"
"Denver Seminary","6399 S. Santa Fe Drive, Littleton, Colorado 80120","www.denverseminary.edu","4-year, Private not-for-profit","Postbaccalaureate certificate|Master's degree|Doctor's degree","Suburb: Large","Yes","885","","NA","NA","Fall 2012","NA","-","126979","00135200"
"Dine College","Route 12, One Circle Drive, Tsaile, Arizona 86556","https://www.dinecollege.edu","4-year, primarily associate's, Public","Less than one year certificate|One but less than two years certificate|Associate's degree|Bachelor's degree","Rural: Remote","Yes","1519","1519","17%","35%","Fall 2012","$8,673","-","105297","00824600"
"Dominican School of Philosophy & Theology","2301 Vine Street, Berkeley, California 94708-1816","https://www.dspt.edu","4-year, Private not-for-profit","Postbaccalaureate certificate|Master's degree","City: Midsize","Yes","57","","NA","NA","Fall 2012","NA","-","113704","00129600"
"Dominican University of California","50 Acacia Ave, San Rafael, California 94901-2298","https://www.dominican.edu","4-year, Private not-for-profit","Bachelor's degree|Master's degree","City: Small","Yes","1779","1355","72%","NA","Fall 2012","$35,801","-","113698","00119600"
"Dongguk University-Los Angeles","440 Shatto Pl, Los Angeles, California 90020-1704","www.dula.edu","4-year, Private not-for-profit","Master's degree|Doctor's degree - professional practice","City: Large","No","107","14","NA","NA","Fall 2012","NA","-","122117","03109500"
"Eastern Connecticut State University","83 Windham St, Willimantic, Connecticut 06226","www.easternct.edu/","4-year, Public","Associate's degree|Bachelor's degree|Master's degree","Town: Fringe","Yes","5208","5013","58%","NA","Fall 2012","$17,769","-","129215","00142500"
"Ecclesia College","9653 Nations Dr, Springdale, Arkansas 72762","www.ecollege.edu/","4-year, Private not-for-profit","Associate's degree|Bachelor's degree|Master's degree","Rural: Fringe","Yes","218","217","20%","58%","Fall 2012","$19,451","-","446233","03855300"
"Embry-Riddle Aeronautical University-Prescott","3700 Willow Creek Road, Prescott, Arizona 86301-3720","prescott.erau.edu/","4-year, Private not-for-profit","Bachelor's degree|Master's degree","Rural: Fringe","Yes","2776","2726","65%","NA","Fall 2012","$33,258","-","104586","00147902"
"Epic Bible College","4330 Auburn Boulevard, Sacramento, California 95841","EPIC.edu","4-year, Private not-for-profit","Associate's degree|Bachelor's degree|Master's degree|Doctor's degree - research/scholarship","Suburb: Large","No","155","119","0%","33%","Fall 2012","NA","-","124487","03403300"
"Fairfield University","1073 N Benson Rd, Fairfield, Connecticut 06824-5195","fairfield.edu","4-year, Private not-for-profit","Bachelor's degree|Postbaccalaureate certificate|Master's degree|Post-master's certificate|Doctor's degree - professional practice","Suburb: Large","Yes","5273","4177","81%","17%","Fall 2012","$39,791","-","129242","00138500"
"Faulkner University","5345 Atlanta Hwy, Montgomery, Alabama 36109-3390","www.faulkner.edu","4-year, Private not-for-profit","Associate's degree|Bachelor's degree|Master's degree|Doctor's degree - research/scholarship|Doctor's degree - professional practice","City: Midsize","Yes","3178","2428","28%","46%","Fall 2012","$21,334","-","101189","00100300"
"Feather River Community College District","570 Golden Eagle Ave, Quincy, California 95971-9124","www.frc.edu","4-year, primarily associate's, Public","Less than one year certificate|One but less than two years certificate|Associate's degree|Bachelor's degree","Rural: Fringe","Yes","2216","2216","18%","34%","Fall 2012","$9,974","-","114433","00859700"
"Fielding Graduate University","2020 De La Vina St, Santa Barbara, California 93105-3538","www.fielding.edu","4-year, Private not-for-profit","Postbaccalaureate certificate|Master's degree|Post-master's certificate|Doctor's degree - research/scholarship","City: Small","No","989","","NA","NA","Fall 2012","NA","-","114549","02096100"
"Foothill College","12345 El Monte Rd, Los Altos Hills, California 94022","https://foothill.edu","4-year, primarily associate's, Public","Less than one year certificate|One but less than two years certificate|Associate's degree|Two but less than 4 years certificate|Bachelor's degree","Suburb: Large","No","14732","14732","63%","11%","Fall 2012","$6,639","-","114716","00119900"
"Fort Lewis College","1000 Rim Drive, Durango, Colorado 81301-3999","fortlewis.edu/","4-year, Public","Two but less than 4 years certificate|Bachelor's degree|Postbaccalaureate certificate|Master's degree","Town: Distant","Yes","3319","3272","44%","37%","Fall 2012","$18,522","-","127185","00135300"
"Franciscan School of Theology","4050 Mission Ave, Oceanside, California 92057","www.fst.edu","4-year, Private not-for-profit","Postbaccalaureate certificate|Master's degree","Suburb: Large","","","","NA","NA","Fall 2012","NA","-","11473401",""
"Franciscan School of Theology","4050 Mission Avenue, Oceanside, California 92057","www.fst.edu","4-year, Private not-for-profit","Postbaccalaureate certificate|Master's degree|Post-master's certificate","Suburb: Large","No","47","","NA","NA","Fall 2012","NA","-","114734","01179200"
"Fresno Pacific University","1717 S Chestnut Ave, Fresno, California 93702-4709","www.fresno.edu","4-year, Private not-for-profit","Associate's degree|Bachelor's degree|Postbaccalaureate certificate|Master's degree","City: Large","Yes","4292","2906","66%","6%","Fall 2012","$19,965","-","114813","00125300"
"Fuller Theological Seminary","135 N Oakland Ave, Pasadena, California 91182","www.fuller.edu","4-year, Private not-for-profit","Postbaccalaureate certificate|Master's degree|Post-master's certificate|Doctor's degree - research/scholarship|Doctor's degree - professional practice","City: Midsize","Yes","2361","","NA","NA","Fall 2012","NA","-","114840","00120000"
"Gallaudet University","800 Florida Ave, NE, Washington, District of Columbia 20002-3695","www.gallaudet.edu","4-year, Private not-for-profit","One but less than two years certificate|Bachelor's degree|Postbaccalaureate certificate|Master's degree|Post-master's certificate|Doctor's degree - research/scholarship|Doctor's degree - other","City: Large","Yes","1557","1138","47%","23%","Fall 2012","$14,718","-","131450","00144300"
"George Washington University","2121 I Street, NW, Washington, District of Columbia 20052","https://www.gwu.edu","4-year, Private not-for-profit","One but less than two years certificate|Associate's degree|Two but less than 4 years certificate|Bachelor's degree|Postbaccalaureate certificate|Master's degree|Post-master's certificate|Doctor's degree - research/scholarship|Doctor's degree - professional practice","City: Large","Yes","28172","12546","82%","NA","Fall 2012","$39,600","-","131469","00144400"
"Georgetown University","37th and O St NW, Washington, District of Columbia 20057-0001","www.georgetown.edu","4-year, Private not-for-profit","One but less than two years certificate|Bachelor's degree|Postbaccalaureate certificate|Master's degree|Doctor's degree - research/scholarship|Doctor's degree - professional practice","City: Large","Yes","19204","7459","94%","NA","Fall 2012","$28,509","-","131496","00144500"
"Golden Gate University-Los Angeles","725 S. Figueroa Street, Suite 1550, Los Angeles, California 90017-5418","www.ggu.edu/","4-year, Private not-for-profit","Master's degree","City: Large","","","","NA","NA","Fall 2012","NA","-","11508303","00120518"
"Golden Gate University-San Francisco","536 Mission Street, San Francisco, California 94105-2968","www.ggu.edu","4-year, Private not-for-profit","Less than one year certificate|Associate's degree|Bachelor's degree|Postbaccalaureate certificate|Master's degree|Post-master's certificate|Doctor's degree - research/scholarship|Doctor's degree - professional practice","City: Large","No","2515","415","NA","NA","Fall 2012","NA","-","115083","00120500"
"Golden Gate University-Silicon Valley","3000 Mission College Blvd, Santa Clara, California 95054-2218","www.ggu.edu/","4-year, Private not-for-profit","Master's degree","City: Midsize","","","","NA","NA","Fall 2012","NA","-","11508306","00120504"
"Goldey-Beacom College","4701 Limestone Rd, Wilmington, Delaware 19808","www.gbc.edu","4-year, Private not-for-profit","Less than one year certificate|Associate's degree|Bachelor's degree|Postbaccalaureate certificate|Master's degree","Suburb: Large","Yes","1493","739","42%","NA","Fall 2012","$15,882","-","130989","00142900"
"Goodwin College","One Riverside Drive, East Hartford, Connecticut 06118","www.goodwin.edu","4-year, primarily associate's, Private not-for-profit","Less than one year certificate|One but less than two years certificate|Associate's degree|Bachelor's degree|Master's degree","City: Small","Yes","3397","3330","40%","18%","Fall 2012","$17,254","-","129154","02244900"
"Grace Mission University","1645 West Valencia Drive, Fullerton, California 92833-3860","www.gm.edu","4-year, Private not-for-profit","Bachelor's degree|Master's degree|Doctor's degree","Suburb: Large","No","194","84","NA","NA","Fall 2012","$14,936","-","481058","04157800"
"Graduate Theological Union","2400 Ridge Rd, Berkeley, California 94709","WWW.GTU.EDU","4-year, Private not-for-profit","Master's degree|Doctor's degree - research/scholarship","City: Midsize","No","196","","NA","NA","Fall 2012","NA","-","115214","00120700"
"Harding University","915 E. Market Ave., Searcy, Arkansas 72149-5615","www.harding.edu","4-year, Private not-for-profit","Bachelor's degree|Master's degree|Post-master's certificate|Doctor's degree - research/scholarship|Doctor's degree - professional practice","Town: Distant","Yes","5121","3974","67%","NA","Fall 2012","$19,580","-","107044","00109700"
"Hartford Seminary","77 Sherman Street, Hartford, Connecticut 06105-2260","www.hartsem.edu","4-year, Private not-for-profit","Postbaccalaureate certificate|Master's degree|Doctor's degree - research/scholarship|Doctor's degree - other","City: Midsize","Yes","138","","NA","NA","Fall 2012","NA","-","129491","00138700"
"Harvey Mudd College","301 Platt Blvd., Claremont, California 91711","https://www.hmc.edu","4-year, Private not-for-profit","Bachelor's degree","Suburb: Large","Yes","902","902","92%","6%","Fall 2012","$38,768","-","115409","00117100"
"Hebrew Union College-Jewish Institute of Religion-Los Angeles","3077 University Ave, Los Angeles, California 90007-3796","huc.edu/","4-year, Private not-for-profit","Postbaccalaureate certificate|Master's degree|Doctor's degree - research/scholarship","City: Large","","","","NA","NA","Fall 2012","NA","-","20306702","00405402"
"Henderson State University","1100 Henderson Street, Arkadelphia, Arkansas 71999-0001","www.hsu.edu","4-year, Public","Less than one year certificate|Associate's degree|Bachelor's degree|Postbaccalaureate certificate|Master's degree|Post-master's certificate","Town: Distant","Yes","3961","3404","35%","39%","Fall 2012","$17,451","-","107071","00109800"
"Hendrix College","1600 Washington Ave, Conway, Arkansas 72032-3080","www.hendrix.edu","4-year, Private not-for-profit","Bachelor's degree|Master's degree","City: Small","Yes","1208","1202","71%","NA","Fall 2012","$22,732","-","107080","00109900"
