"Name","Address","Website","Type","Awards offered","Campus setting","Campus housing","Student population","Undergraduate students","Graduation Rate","Transfer-Out Rate","Cohort Year *","Net Price **","Largest Program","IPEDS ID","OPE ID"
"Montreat College","310 Gaither Circle, Montreat, North Carolina 28757-1267","www.montreat.edu","4-year, Private not-for-profit","Associate's degree|Bachelor's degree|Master's degree","Suburb: Large","Yes","921","795","43%","NA","Fall 2012","$21,454","-","199032","00294800"
"Mount Saint Mary College","330 Powell Avenue, Newburgh, New York 12550","www.msmc.edu","4-year, Private not-for-profit","Less than one year certificate|Bachelor's degree|Master's degree|Post-master's certificate","Suburb: Large","Yes","2352","2005","57%","NA","Fall 2012","$24,770","-","193353","00277800"
"Navajo Technical University","Lower Point Road, State Road 371, Crownpoint, New Mexico 87313-0849","www.navajotech.edu","4-year, primarily associate's, Public","Less than one year certificate|One but less than two years certificate|Associate's degree|Bachelor's degree|Master's degree","Rural: Remote","Yes","1600","1595","14%","NA","Fall 2012","$5,159","-","187596","02357600"
"Nazareth College","4245 East Ave, Rochester, New York 14618-3790","www.naz.edu","4-year, Private not-for-profit","Bachelor's degree|Master's degree|Doctor's degree - professional practice","Suburb: Large","Yes","2987","2269","66%","27%","Fall 2012","$29,881","-","193584","00277900"
"New Brunswick Theological Seminary","35 Seminary Place, New Brunswick, New Jersey 08901-1107","www.nbts.edu","4-year, Private not-for-profit","Master's degree|Doctor's degree - research/scholarship","City: Small","No","128","","NA","NA","Fall 2012","NA","-","185758","00261900"
"New England College","98 Bridge St, Henniker, New Hampshire 03242","www.nec.edu/","4-year, Private not-for-profit","Associate's degree|Bachelor's degree|Master's degree|Post-master's certificate|Doctor's degree - professional practice","Rural: Distant","Yes","2521","1696","25%","47%","Fall 2012","$27,800","-","182980","00257900"
"New Hampshire Institute of Art","148 Concord St, Manchester, New Hampshire 03104-4858","www.nhia.edu","4-year, Private not-for-profit","Bachelor's degree|Postbaccalaureate certificate|Master's degree","City: Midsize","Yes","337","283","47%","NA","Fall 2012","$33,020","-","430810","03182300"
"New Jersey City University","2039 Kennedy Blvd, Jersey City, New Jersey 07305","www.njcu.edu","4-year, Public","Bachelor's degree|Postbaccalaureate certificate|Master's degree|Post-master's certificate|Doctor's degree - research/scholarship","City: Large","Yes","7991","6237","39%","31%","Fall 2012","$12,476","-","185129","00261300"
"New Jersey Institute of Technology","University Heights, Newark, New Jersey 07102","www.njit.edu/","4-year, Public","Bachelor's degree|Postbaccalaureate certificate|Master's degree|Doctor's degree - research/scholarship","City: Large","Yes","11423","8532","65%","27%","Fall 2012","$17,855","-","185828","00262100"
"New Mexico Highlands University","University Ave, Las Vegas, New Mexico 87701","www.nmhu.edu","4-year, Public","Less than one year certificate|Associate's degree|Bachelor's degree|Postbaccalaureate certificate|Master's degree","Town: Remote","Yes","3037","1868","21%","46%","Fall 2012","$10,821","-","187897","00265300"
"New Mexico Institute of Mining and Technology","801 Leroy Place, Socorro, New Mexico 87801","www.nmt.edu","4-year, Public","Associate's degree|Bachelor's degree|Postbaccalaureate certificate|Master's degree|Doctor's degree - research/scholarship","Town: Remote","Yes","1895","1412","56%","NA","Fall 2012","$14,641","-","187967","00265400"
"New Mexico State University-Main Campus","2850 Weddell Street, Las Cruces, New Mexico 88003-8001","www.nmsu.edu/","4-year, Public","Associate's degree|Bachelor's degree|Postbaccalaureate certificate|Master's degree|Post-master's certificate|Doctor's degree - research/scholarship|Doctor's degree - professional practice","Suburb: Midsize","Yes","14289","11687","47%","NA","Fall 2012","$9,462","-","188030","00265700"
"New York Academy of Art","111 Franklin St, New York, New York 10013-2911","www.nyaa.edu","4-year, Private not-for-profit","Postbaccalaureate certificate|Master's degree","City: Large","No","125","","NA","NA","Fall 2012","NA","-","366368","02600100"
"New York Chiropractic College","2360 State Route 89, Seneca Falls, New York 13148-0800","www.nycc.edu","4-year, Private not-for-profit","Master's degree|Doctor's degree - professional practice","Town: Distant","Yes","895","","NA","NA","Fall 2012","NA","-","193751","01227700"
"New York College of Health Professions","6801 Jericho Tpk, Syosset, New York 11791-4413","www.nycollege.edu","4-year, primarily associate's, Private not-for-profit","Associate's degree|Bachelor's degree|Master's degree","Suburb: Large","No","473","354","32%","NA","Fall 2012","$21,029","-","418126","02599400"
"New York College of Podiatric Medicine","53 East 124 Street, New York, New York 10035-1940","www.nycpm.edu","4-year, Private not-for-profit","Doctor's degree - professional practice","City: Large","Yes","350","","NA","NA","Fall 2012","NA","-","194073","00274900"
"New York College of Traditional Chinese Medicine","200 Old Country Road, Suite 500, Mineola, New York 11501","www.nyctcm.edu","4-year, Private not-for-profit","Master's degree|Post-master's certificate","Suburb: Large","No","186","67","NA","NA","Fall 2012","NA","-","439783","03443300"
"New York Institute of Technology","Northern Blvd, Old Westbury, New York 11568-8000","www.nyit.edu","4-year, Private not-for-profit","Less than one year certificate|Associate's degree|Bachelor's degree|Postbaccalaureate certificate|Master's degree|Post-master's certificate|Doctor's degree - professional practice","Suburb: Large","Yes","7173","3648","51%","37%","Fall 2012","$22,187","-","194091","00278200"
"New York Law School","185 West Broadway, New York, New York 10013-2921","www.nyls.edu","4-year, Private not-for-profit","Master's degree|Post-master's certificate|Doctor's degree - professional practice","City: Large","Yes","1042","","NA","NA","Fall 2012","NA","-","193821","00278300"
"New York Medical College","Administration Building, Valhalla, New York 10595","WWW.NYMC.EDU","4-year, Private not-for-profit","Postbaccalaureate certificate|Master's degree|Doctor's degree - research/scholarship|Doctor's degree - professional practice","Suburb: Large","Yes","1462","","NA","NA","Fall 2012","NA","-","193830","00278400"
"New York School of Interior Design","170 East 70th Street, New York, New York 10021","www.nysid.edu","4-year, Private not-for-profit","Less than one year certificate|Associate's degree|Bachelor's degree|Master's degree","City: Large","Yes","537","378","63%","19%","Fall 2012","$34,545","-","194116","02069000"
"New York Theological Seminary","475 Riverside Dr  Ste 500, New York, New York 10115","nyts.edu","4-year, Private not-for-profit","Master's degree|Doctor's degree - professional practice","City: Large","No","317","","NA","NA","Fall 2012","NA","-","193894","00267400"
"New York University","70 Washington Sq South, New York, New York 10012-1091","www.nyu.edu","4-year, Private not-for-profit","Less than one year certificate|Associate's degree|Bachelor's degree|Postbaccalaureate certificate|Master's degree|Post-master's certificate|Doctor's degree - research/scholarship|Doctor's degree - professional practice|Doctor's degree - other","City: Large","Yes","51847","26733","85%","8%","Fall 2012","$39,935","-","193900","00278500"
"Niagara University","Lewiston Road, Niagara University, New York 14109","www.niagara.edu","4-year, Private not-for-profit","Associate's degree|Bachelor's degree|Postbaccalaureate certificate|Master's degree|Post-master's certificate|Doctor's degree - research/scholarship","Suburb: Large","Yes","3763","2816","71%","NA","Fall 2012","$19,106","-","193973","00278800"
"North Carolina A & T State University","1601 E Market  St, Greensboro, North Carolina 27411","www.ncat.edu","4-year, Public","Bachelor's degree|Postbaccalaureate certificate|Master's degree|Doctor's degree - research/scholarship","City: Large","Yes","12142","10629","53%","25%","Fall 2012","$9,378","-","199102","00290500"
"North Carolina Central University","1801 Fayetteville Street, Durham, North Carolina 27707","www.nccu.edu","4-year, Public","Bachelor's degree|Postbaccalaureate certificate|Master's degree|Doctor's degree - research/scholarship|Doctor's degree - professional practice","City: Large","Yes","8207","6434","46%","32%","Fall 2012","$12,470","-","199157","00295000"
"North Carolina State University at Raleigh","2101 Hillsborough Street, Raleigh, North Carolina 27695-7001","www.ncsu.edu","4-year, Public","Associate's degree|Bachelor's degree|Postbaccalaureate certificate|Master's degree|Doctor's degree - research/scholarship|Doctor's degree - professional practice","City: Large","Yes","35479","25199","81%","12%","Fall 2012","$14,771","-","199193","00297200"
"North Carolina Wesleyan College","3400 N Wesleyan Blvd, Rocky Mount, North Carolina 27804","www.ncwc.edu","4-year, Private not-for-profit","Bachelor's degree|Master's degree","City: Small","Yes","2034","2007","29%","49%","Fall 2012","$16,419","-","199209","00295100"
"North Dakota State University-Main Campus","1301  12th Avenue North, Fargo, North Dakota 58108-6050","https://www.ndsu.edu","4-year, Public","Less than one year certificate|Bachelor's degree|Postbaccalaureate certificate|Master's degree|Post-master's certificate|Doctor's degree - research/scholarship|Doctor's degree - professional practice","City: Midsize","Yes","13796","11425","58%","28%","Fall 2012","$15,472","-","200332","00299700"
"Northeast Catholic College","511 Kearsarge Mountain Road, Warner, New Hampshire 03278-4012","www.northeastcatholic.edu","4-year, Private not-for-profit","Associate's degree|Bachelor's degree","Rural: Distant","Yes","83","83","69%","8%","Fall 2012","$12,442","-","182917","02223300"
"Northeastern Seminary","2265 Westside Dr, Rochester, New York 14624","www.nes.edu/","4-year, Private not-for-profit","Master's degree|Doctor's degree","Suburb: Large","No","133","","NA","NA","Fall 2012","NA","-","439817","03419400"
"Northern New Mexico College","921 Paseo de Onate, Espanola, New Mexico 87532","nnmc.edu","4-year, primarily associate's, Public","Less than one year certificate|One but less than two years certificate|Associate's degree|Two but less than 4 years certificate|Bachelor's degree|Postbaccalaureate certificate","Town: Distant","No","926","926","22%","13%","Fall 2012","$6,884","-","188058","02083900"
"Nueta Hidatsa Sahnish College","301 College Drive, New Town, North Dakota 58763","www.nhsc.edu","4-year, primarily associate's, Public","Less than one year certificate|One but less than two years certificate|Associate's degree|Bachelor's degree","Rural: Remote","Yes","198","198","0%","NA","Fall 2012","$8,691","-","200086","02553700"
"Nyack College","1 South Blvd, Nyack, New York 10960-3698","www.nyack.edu/consumerinfo","4-year, Private not-for-profit","Associate's degree|Bachelor's degree|Master's degree|Doctor's degree - professional practice","Suburb: Large","Yes","2351","1339","42%","NA","Fall 2012","$20,217","-","194161","00279000"
"Ohr Hameir Theological Seminary","141 Furnace Woods Rd, Peekskill, New York 10566","https://ohrhameir.com","4-year, primarily associate's, Private not-for-profit","Associate's degree|Bachelor's degree","Suburb: Large","Yes","94","94","100%","NA","Fall 2012","$18,450","-","194189","01198400"
"Pace University","1 Pace Plaza, New York, New York 10038-1598","www.pace.edu","4-year, Private not-for-profit","Less than one year certificate|Associate's degree|Bachelor's degree|Postbaccalaureate certificate|Master's degree|Post-master's certificate|Doctor's degree - research/scholarship|Doctor's degree - professional practice","City: Large","Yes","13326","8677","56%","30%","Fall 2012","$31,923","-","194310","00279100"
"Paul Smiths College of Arts and Science","7777 State Route 30, Paul Smiths, New York 12970-0265","www.paulsmiths.edu","4-year, Private not-for-profit","Associate's degree|Bachelor's degree","Rural: Distant","Yes","745","745","51%","NA","Fall 2012","$26,343","-","194392","00279500"
"Pfeiffer University","48380 US Hwy 52N, Misenheimer, North Carolina 28109-0960","www.pfeiffer.edu","4-year, Private not-for-profit","Less than one year certificate|Bachelor's degree|Postbaccalaureate certificate|Master's degree|Post-master's certificate","Rural: Distant","Yes","1365","900","43%","NA","Fall 2012","$19,554","-","199306","00295500"
"Phillips School of Nursing at Mount Sinai Beth Israel","766 Avenue of the Americas 4th Floor, New York, New York 10001-6354","www.pson.edu","4-year, primarily associate's, Private not-for-profit","Associate's degree|Bachelor's degree","City: Large","No","199","199","100%","NA","Fall 2012","NA","-","189282","00643800"
"Piedmont International University","420 S. Broad St., Winston-Salem, North Carolina 27101","www.piedmontu.edu","4-year, Private not-for-profit","One but less than two years certificate|Associate's degree|Bachelor's degree|Master's degree|Doctor's degree - research/scholarship|Doctor's degree - professional practice","City: Midsize","Yes","896","496","36%","15%","Fall 2012","$13,491","-","489937","00295600"
"Pillar College","60 Park Place, Suite 701, Newark, New Jersey 07102","www.pillar.edu","4-year, Private not-for-profit","Associate's degree|Bachelor's degree|Master's degree","City: Large","No","584","505","36%","NA","Fall 2012","$21,668","-","440794","03666300"
"Plymouth State University","17 High Street, Plymouth, New Hampshire 03264-1595","www.plymouth.edu","4-year, Public","Less than one year certificate|Bachelor's degree|Postbaccalaureate certificate|Master's degree|Post-master's certificate|Doctor's degree - research/scholarship|Doctor's degree - professional practice","Town: Remote","Yes","5059","4222","53%","NA","Fall 2012","$21,143","-","183080","00259100"
"Pratt Institute-Main","200 Willoughby Ave, Brooklyn, New York 11205","www.pratt.edu","4-year, Private not-for-profit","Associate's degree|Bachelor's degree|Postbaccalaureate certificate|Master's degree|Post-master's certificate","City: Large","Yes","5015","3634","72%","2%","Fall 2012","$44,920","-","194578","00279800"
"Pratt Manhattan-A Division of Pratt Institute","144 West 14th Street, New York, New York 10011","https://www.pratt.edu","4-year, Private not-for-profit","Associate's degree|Bachelor's degree|Master's degree|Post-master's certificate","City: Large","Yes","","","NA","NA","Fall 2012","NA","-","19457801","00279803"
"Princeton Theological Seminary","64 Mercer St, Princeton, New Jersey 08542-0803","www.ptsem.edu","4-year, Private not-for-profit","Master's degree|Doctor's degree - research/scholarship","Suburb: Large","Yes","441","","NA","NA","Fall 2012","NA","-","186122","00262600"
"Princeton University","1 Nassau Hall, Princeton, New Jersey 08544-0070","www.princeton.edu","4-year, Private not-for-profit","Bachelor's degree|Master's degree|Doctor's degree - research/scholarship","Suburb: Large","Yes","8374","5428","96%","NA","Fall 2012","$16,192","-","186131","00262700"
"Queens University of Charlotte","1900 Selwyn Ave, Charlotte, North Carolina 28274-0001","www.queens.edu","4-year, Private not-for-profit","Bachelor's degree|Postbaccalaureate certificate|Master's degree|Post-master's certificate","City: Large","Yes","2536","1766","53%","NA","Fall 2012","$21,651","-","199412","00295700"
"Rabbi Jacob Joseph School","One Plainfield Ave, Edison, New Jersey 08817-4494","https://rabbijacobjoseph.com","4-year, Private not-for-profit","Associate's degree|Bachelor's degree","Suburb: Large","Yes","57","57","10%","48%","Fall 2012","$9,160","-","384421","03077500"
"Rabbinical Academy Mesivta Rabbi Chaim Berlin","1593 Coney Island Ave, Brooklyn, New York 11230","https://rabbinicalacademyrabbichaimberlin.com","4-year, Private not-for-profit","Bachelor's degree|Master's degree|Doctor's degree - research/scholarship","City: Large","Yes","312","174","38%","3%","Fall 2012","$7,646","-","194657","00397600"
"Rabbinical College Beth Shraga","28 Saddle River Rd, Monsey, New York 10952-3033","https://rabbinicalcollegebethshraga.com","4-year, primarily associate's, Private not-for-profit","Associate's degree|Bachelor's degree","Suburb: Large","Yes","47","47","7%","67%","Fall 2012","$16,050","-","194693","01094300"
"Rabbinical College Bobover Yeshiva Bnei Zion","1577 48th St, Brooklyn, New York 11219","rabbinicalcollegeboboveryeshiva.edu","4-year, Private not-for-profit","Bachelor's degree|Master's degree","City: Large","Yes","386","359","87%","NA","Fall 2012","$4,385","-","194666","00861400"
"Rabbinical College of America","226 Sussex Ave, Morristown, New Jersey 07960-3600","www.rca.edu/","4-year, Private not-for-profit","Associate's degree|Bachelor's degree|Master's degree","Suburb: Large","Yes","230","224","8%","35%","Fall 2012","$14,673","-","186186","00860900"
"Rabbinical College of Long Island","205 W Beech St, Long Beach, New York 11561","https://rabbinicalcollegelongisland.com","4-year, primarily associate's, Private not-for-profit","Bachelor's degree","Suburb: Large","Yes","156","156","NA","NA","Fall 2012","$11,060","-","194736","01037800"
"Rabbinical College of Ohr Shimon Yisroel","215-217 Hewes St, Brooklyn, New York 11211","","4-year, Private not-for-profit","Bachelor's degree","City: Large","Yes","218","218","44%","44%","Fall 2012","$9,722","-","405854","03129200"
"Rabbinical College Ohr Yisroel","8800 Seaview Ave, Brooklyn, New York 11236","www.rabbinicalcollegeohryisroel.com","4-year, Private not-for-profit","Bachelor's degree","City: Large","Yes","122","122","NA","NA","Fall 2012","$4,774","-","484871","04230100"
"Rabbinical Seminary of America","76-01 147th St, Flushing, New York 11367","","4-year, Private not-for-profit","Bachelor's degree|Postbaccalaureate certificate|Master's degree|Post-master's certificate|Doctor's degree","City: Large","Yes","472","267","27%","NA","Fall 2012","$9,002","-","194763","00397800"
"Ramapo College of New Jersey","505 Ramapo Valley Rd, Mahwah, New Jersey 07430-1680","www.ramapo.edu","4-year, Public","Bachelor's degree|Postbaccalaureate certificate|Master's degree|Post-master's certificate","Suburb: Large","Yes","6174","5609","74%","19%","Fall 2012","$16,528","-","186201","00934400"
"Relay Graduate School of Education","40 W 20th St, 7th Fl, New York, New York 10011","www.relay.edu","4-year, Private not-for-profit","Less than one year certificate|Master's degree","City: Large","No","4017","259","NA","NA","Fall 2012","NA","-","475033","04208600"
"Relay Graduate School of Education - Newark","72 Central Ave, Newark, New Jersey 07102","relay.edu/location/relay-newark","4-year, Private not-for-profit","Less than one year certificate|Master's degree","City: Large","","","","NA","NA","Fall 2012","NA","-","47503301","04208601"
"Rensselaer Polytechnic Institute","110 8th St, Troy, New York 12180-3590","www.rpi.edu","4-year, Private not-for-profit","Bachelor's degree|Master's degree|Doctor's degree - research/scholarship","City: Small","Yes","7895","6628","86%","2%","Fall 2012","$39,308","-","194824","00280300"
"Rider University","2083 Lawrence Road, Lawrenceville, New Jersey 08648-3099","www.rider.edu","4-year, Private not-for-profit","One but less than two years certificate|Associate's degree|Bachelor's degree|Postbaccalaureate certificate|Master's degree|Post-master's certificate|Doctor's degree - research/scholarship","Suburb: Large","Yes","4824","3920","65%","NA","Fall 2012","$29,284","-","186283","00262800"
"Rivier University","420 South Main St, Nashua, New Hampshire 03060","www.rivier.edu","4-year, Private not-for-profit","Associate's degree|Bachelor's degree|Master's degree|Post-master's certificate|Doctor's degree - research/scholarship|Doctor's degree - professional practice","City: Small","Yes","2319","1445","51%","NA","Fall 2012","$24,900","-","183211","00258600"
"Roberts Wesleyan College","2301 Westside Dr, Rochester, New York 14624","www.roberts.edu","4-year, Private not-for-profit","Associate's degree|Bachelor's degree|Master's degree|Doctor's degree - professional practice","Suburb: Large","Yes","1739","1335","68%","21%","Fall 2012","$23,673","-","194958","00280500"
"Rochester Institute of Technology","1 Lomb Memorial Dr, Rochester, New York 14623-5603","www.rit.edu/","4-year, Private not-for-profit","Less than one year certificate|One but less than two years certificate|Associate's degree|Bachelor's degree|Postbaccalaureate certificate|Master's degree|Doctor's degree - research/scholarship","Suburb: Large","Yes","16463","13513","67%","NA","Fall 2012","$31,798","-","195003","00280600"
"Rockefeller University","1230 York Avenue, New York, New York 10065-6399","www.rockefeller.edu","4-year, Private not-for-profit","Master's degree|Doctor's degree - research/scholarship","City: Large","Yes","239","","NA","NA","Fall 2012","NA","-","195049","00280700"
"Rowan University","201 Mullica Hill Road, Glassboro, New Jersey 08028","https://www.rowan.edu","4-year, Public","Less than one year certificate|Bachelor's degree|Postbaccalaureate certificate|Master's degree|Post-master's certificate|Doctor's degree - research/scholarship|Doctor's degree - professional practice","Suburb: Large","Yes","19465","16120","72%","16%","Fall 2012","$21,535","-","184782","00260900"
"Rutgers University-Camden","406 Penn, Camden, New Jersey 08102","https://www.camden.rutgers.edu/","4-year, Public","Bachelor's degree|Postbaccalaureate certificate|Master's degree|Post-master's certificate|Doctor's degree - research/scholarship|Doctor's degree - professional practice","City: Small","Yes","7171","5776","58%","23%","Fall 2012","$12,279","-","186371","00262901"
"Rutgers University-New Brunswick","83 Somerset St, New Brunswick, New Jersey 08901-1281","https://newbrunswick.rutgers.edu/","4-year, Public","One but less than two years certificate|Associate's degree|Bachelor's degree|Postbaccalaureate certificate|Master's degree|Post-master's certificate|Doctor's degree - research/scholarship|Doctor's degree - professional practice","City: Small","Yes","50254","36039","80%","10%","Fall 2012","$16,295","-","186380","00262900"
"Rutgers University-Newark","249 University Avenue, Blumenthal Hall, Newark, New Jersey 07102","https://www.newark.rutgers.edu/","4-year, Public","Bachelor's degree|Postbaccalaureate certificate|Master's degree|Post-master's certificate|Doctor's degree - research/scholarship|Doctor's degree - professional practice","City: Large","Yes","13451","9142","64%","21%","Fall 2012","$11,301","-","186399","00262902"
"Saint Anselm College","100 Saint Anselm Drive, Manchester, New Hampshire 03102-1310","www.anselm.edu","4-year, Private not-for-profit","Bachelor's degree","Suburb: Midsize","Yes","2024","2024","77%","NA","Fall 2012","$32,255","-","183239","00258700"
"Saint Augustine's University","1315 Oakwood Avenue, Raleigh, North Carolina 27610-2298","www.st-aug.edu","4-year, Private not-for-profit","Bachelor's degree","City: Large","Yes","767","767","31%","45%","Fall 2012","$25,668","-","199582","00296800"
"Saint John Fisher College","3690 East Ave, Rochester, New York 14618-3597","https://www.sjfc.edu","4-year, Private not-for-profit","Less than one year certificate|Bachelor's degree|Postbaccalaureate certificate|Master's degree|Post-master's certificate|Doctor's degree - research/scholarship|Doctor's degree - professional practice","Suburb: Large","Yes","3712","2743","73%","23%","Fall 2012","$27,794","-","195720","00282100"
"Saint John's University - Staten Island Campus","300 Howard Avenue, Staten Island, New York 10301-4496","www.stjohns.edu/campuses/staten-island-campus","4-year, Private not-for-profit","One but less than two years certificate|Associate's degree|Bachelor's degree|Postbaccalaureate certificate|Master's degree|Post-master's certificate","City: Large","Yes","","","NA","NA","Fall 2012","NA","-","19580901","00282301"
"Saint Peter's University","2641 Kennedy Blvd, Jersey City, New Jersey 07306-5997","www.saintpeters.edu","4-year, Private not-for-profit","Associate's degree|Bachelor's degree|Postbaccalaureate certificate|Master's degree|Post-master's certificate|Doctor's degree - research/scholarship|Doctor's degree - professional practice","City: Large","Yes","3452","2641","50%","NA","Fall 2012","$13,246","-","186432","00263800"
"Saint Vladimirs Orthodox Theological Seminary","575 Scarsdale Rd, Yonkers, New York 10707-1699","www.svots.edu","4-year, Private not-for-profit","Master's degree|Doctor's degree - professional practice","Suburb: Large","Yes","90","","NA","NA","Fall 2012","NA","-","195580","00283300"
"Salem College","601 S Church St, Winston-Salem, North Carolina 27101","www.salem.edu/","4-year, Private not-for-profit","Less than one year certificate|Bachelor's degree|Master's degree","City: Midsize","Yes","842","704","60%","26%","Fall 2012","$15,560","-","199607","00296000"
"Sarah Lawrence College","One Meadway, Bronxville, New York 10708","www.sarahlawrence.edu","4-year, Private not-for-profit","Bachelor's degree|Master's degree","Suburb: Large","Yes","1709","1410","73%","17%","Fall 2012","$40,022","-","195304","00281300"
"Seton Hall University","400 S Orange Ave, South Orange, New Jersey 07079-2697","www.shu.edu/","4-year, Private not-for-profit","Bachelor's degree|Master's degree|Post-master's certificate|Doctor's degree - research/scholarship|Doctor's degree - professional practice","Suburb: Large","Yes","10162","6136","70%","24%","Fall 2012","$29,974","-","186584","00263200"
"Shaw University","118 East South Street, Raleigh, North Carolina 27601","www.shawu.edu","4-year, Private not-for-profit","Bachelor's degree|Master's degree","City: Large","Yes","1411","1305","15%","NA","Fall 2012","$18,773","-","199643","00296200"
